{
  "id": "IxexyLDIIk",
  "at": 2,
  "bcat": ["IAB25", "IAB7-39", "IAB8-18", "IAB8-5", "IAB9-9"],
  "badv": ["apple.com", "go-text.me", "heywire.com"],
  "imp": [
    {
      "id": "1",
      "bidfloor": 0.5,
      "instl": 0,
      "tagid": "agltb3B1Yi1pbmNyDQsSBFNpdGUY7fD0FAw",
      "banner": {
        "w": 728,
        "h": 90,
        "pos": 1,
        "btype": [4],
        "battr": [14],
        "api": [3]
      }
    }
  ],
  "app": {
    "id": "agltb3B1Yi1pbmNyDAsSA0FwcBiJkfIUDA",
    "name": "Yahoo Weather",
    "cat": ["IAB15", "IAB15-10"],
    "ver": "1.0.2",
    "bundle": "12345",
    "storeurl": "https://itunes.apple.com/id628677149",
    "publisher": {
      "id": "agltb3B1Yi1pbmNyDAsSA0FwcBiJkfTUCV",
      "name": "yahoo",
      "domain": "www.yahoo.com"
    }
  },
  "device": {
    "dnt": 0,
    "ua": "Mozilla/5.0 (iPhone; CPU iPhone OS 6_1 like Mac OS X) AppleWebKit/534.46 (KHTML, like Gecko) Version/5.1 Mobile/9A334 Safari/7534.48.3",
    "ifa": "AA000DFE74168477C70D291f574D344790E0BB11",
    "carrier": "VERIZON",
    "language": "en",
    "make": "Apple",
    "model": "iPhone",
    "os": "iOS",
    "osv": "6.1",
    "js": 1,
    "connectiontype": 3,
    "devicetype": 1
  },
  "user": {
    "id": "ffffffd5135596709273b3a1a07e466ea2bf4fff"
  }
}
