{
  "id": "80ce30c53c16e6ede735f123ef6e32361bfc7b22",
  "at": 1,
  "cur": ["USD"],
  "imp": [
    {
      "id": "1",
      "bidfloor": 0.03,
      "banner": {
        "h": 250,
        "w": 300,
        "pos": 0
      },
      "pmp": {
        "private_auction": 1,
        "deals": [
          {
            "id": "AB-Agency1-0001",
            "at": 1,
            "bidfloor": 2.5,
            "wseat": ["Agency1"]
          },
          {
            "id": "XY-Agency2-0001",
            "at": 2,
            "bidfloor": 2,
            "wseat": ["Agency2"]
          }
        ]
      }
    }
  ],
  "site": {
    "id": "102855",
    "domain": "www.foobar.com",
    "cat": ["IAB3-1"],
    "page": "http://www.foobar.com/1234.html",
    "publisher": {
      "id": "8953",
      "name": "foobar.com",
      "cat": ["IAB3-1"],
      "domain": "foobar.com"
    }
  },
  "device": {
    "ua": "Mozilla/5.0 (Macintosh; Intel Mac OS X 10_6_8) AppleWebKit/537.13 (KHTML, like Gecko) Version/5.1.7 Safari/534.57.2"
  },
  "user": {
    "id": "55816b39711f9b5acf3b90e313ed29e51665623f"
  }
}
